{
  "schema_version": 1,
  "service": "api-gateway",
  "namespace": "platform",
  "lookback_window": "7d",
  "generated_at": "2026-07-01T00:00:00Z",
  "indicators": {
    "latency": {
      "p50_ms": 12.0,
      "p90_ms": 35.0,
      "p95_ms": 42.0,
      "p99_ms": 50.0,
      "stddev_ms": 10.5,
      "sample_count": 60000000,
      "source_query": "histogram_quantile(0.99, rate(http_request_duration_seconds_bucket[5m]))"
    },
    "error_rate": {
      "ratio": 0.0001,
      "stddev": 0.00004,
      "error_count": 6000,
      "total_count": 60000000,
      "source_query": "sum(rate(http_requests_total{code=~\"5..\"}[5m])) / sum(rate(http_requests_total[5m]))"
    },
    "availability": {
      "ratio": 0.9999,
      "definition": "1 - (error_count / total_count)"
    },
    "throughput": {
      "mean_rps": 1000.0,
      "p95_rps": 1500.0,
      "stddev_rps": 200.0,
      "sample_count": 2016
    },
    "saturation": {
      "cpu_mean_ratio": 0.15,
      "cpu_p95_ratio": 0.25,
      "memory_mean_ratio": 0.3,
      "memory_p95_ratio": 0.38,
      "available": true
    }
  },
  "provenance": {
    "prometheus_endpoint": "https://prometheus.example.com",
    "query_timestamps": {
      "start": "2026-06-24T00:00:00Z",
      "end": "2026-07-01T00:00:00Z"
    },
    "coverage_ratio": 0.999
  }
}
